Nome,Número,Peso,Altura,Tipos,Habilidades,Habilidades Descrição,Habilidades URL,Url Pokémon,Evoluções,Evoluções Número,Evoluções URL
Corviknight,823,75.0 kg,220.00000000000003 cm,"Flying,Steel","Pressure,Unnerve,Mirror Armor"," The Pokémon raises the foe's PP usage., Makes the foe nervous and unable to eat Berries., Reflects any stat-lowering effects."," https://pokemondb.net/ability/pressure, https://pokemondb.net/ability/unnerve, https://pokemondb.net/ability/mirror-armor",https://pokemondb.net/pokedex/corviknight,,,
Corvisquire,822,16.0 kg,80.0 cm,Flying,"Keen Eye,Unnerve,Big Pecks"," Prevents other Pokémon from lowering accuracy., Makes the foe nervous and unable to eat Berries., Protects the Pokémon from Defense-lowering attacks."," https://pokemondb.net/ability/keen-eye, https://pokemondb.net/ability/unnerve, https://pokemondb.net/ability/big-pecks",https://pokemondb.net/pokedex/corvisquire,Corviknight, #0823," https://pokemondb.net/pokedex/corvisquire, https://pokemondb.net/pokedex/corviknight"
Rookidee,821,1.8 kg,20.0 cm,Flying,"Keen Eye,Unnerve,Big Pecks"," Prevents other Pokémon from lowering accuracy., Makes the foe nervous and unable to eat Berries., Protects the Pokémon from Defense-lowering attacks."," https://pokemondb.net/ability/keen-eye, https://pokemondb.net/ability/unnerve, https://pokemondb.net/ability/big-pecks",https://pokemondb.net/pokedex/rookidee,"Corvisquire,Corviknight"," #0822, #0823"," https://pokemondb.net/pokedex/corvisquire, https://pokemondb.net/pokedex/corviknight"
Blipbug,824,8.0 kg,40.0 cm,Bug,"Swarm,Compound Eyes,Telepathy"," Powers up Bug-type moves in a pinch., The Pokémon's accuracy is boosted., Anticipates an ally's attack and dodges it."," https://pokemondb.net/ability/swarm, https://pokemondb.net/ability/compound-eyes, https://pokemondb.net/ability/telepathy",https://pokemondb.net/pokedex/blipbug,"Dottler,Orbeetle"," #0825, #0826"," https://pokemondb.net/pokedex/dottler, https://pokemondb.net/pokedex/orbeetle"
Greedent,820,6.0 kg,60.0 cm,Normal,"Cheek Pouch,Gluttony"," Restores additional HP when a Berry is consumed., Encourages the early use of a held Berry."," https://pokemondb.net/ability/cheek-pouch, https://pokemondb.net/ability/gluttony",https://pokemondb.net/pokedex/greedent,,,
Orbeetle,826,40.8 kg,40.0 cm,"Bug,Psychic","Swarm,Frisk,Telepathy"," Powers up Bug-type moves in a pinch., The Pokémon can check a foe's held item., Anticipates an ally's attack and dodges it."," https://pokemondb.net/ability/swarm, https://pokemondb.net/ability/frisk, https://pokemondb.net/ability/telepathy",https://pokemondb.net/pokedex/orbeetle,,,
Inteleon,818,45.2 kg,190.0 cm,Water,"Torrent,Sniper"," Powers up Water-type moves in a pinch., Powers up moves if they become critical hits."," https://pokemondb.net/ability/torrent, https://pokemondb.net/ability/sniper",https://pokemondb.net/pokedex/inteleon,,,
Drizzile,817,11.5 kg,70.0 cm,Water,"Torrent,Sniper"," Powers up Water-type moves in a pinch., Powers up moves if they become critical hits."," https://pokemondb.net/ability/torrent, https://pokemondb.net/ability/sniper",https://pokemondb.net/pokedex/drizzile,Inteleon, #0818," https://pokemondb.net/pokedex/drizzile, https://pokemondb.net/pokedex/inteleon"
Sobble,816,4.0 kg,30.0 cm,Water,"Torrent,Sniper"," Powers up Water-type moves in a pinch., Powers up moves if they become critical hits."," https://pokemondb.net/ability/torrent, https://pokemondb.net/ability/sniper",https://pokemondb.net/pokedex/sobble,"Drizzile,Inteleon"," #0817, #0818"," https://pokemondb.net/pokedex/drizzile, https://pokemondb.net/pokedex/inteleon"
Raboot,814,9.0 kg,60.0 cm,Fire,"Blaze,Libero"," Powers up Fire-type moves in a pinch., Changes the Pokémon's type to its last used move."," https://pokemondb.net/ability/blaze, https://pokemondb.net/ability/libero",https://pokemondb.net/pokedex/raboot,Cinderace, #0815," https://pokemondb.net/pokedex/raboot, https://pokemondb.net/pokedex/cinderace"
Cinderace,815,33.0 kg,140.0 cm,Fire,"Blaze,Libero"," Powers up Fire-type moves in a pinch., Changes the Pokémon's type to its last used move."," https://pokemondb.net/ability/blaze, https://pokemondb.net/ability/libero",https://pokemondb.net/pokedex/cinderace,,,
Thwackey,811,14.0 kg,70.0 cm,Grass,"Overgrow,Grassy Surge"," Powers up Grass-type moves in a pinch., The Pokémon creates a Grassy Terrain when it enters a battle."," https://pokemondb.net/ability/overgrow, https://pokemondb.net/ability/grassy-surge",https://pokemondb.net/pokedex/thwackey,Rillaboom, #0812," https://pokemondb.net/pokedex/thwackey, https://pokemondb.net/pokedex/rillaboom"
Scorbunny,813,4.5 kg,30.0 cm,Fire,"Blaze,Libero"," Powers up Fire-type moves in a pinch., Changes the Pokémon's type to its last used move."," https://pokemondb.net/ability/blaze, https://pokemondb.net/ability/libero",https://pokemondb.net/pokedex/scorbunny,"Raboot,Cinderace"," #0814, #0815"," https://pokemondb.net/pokedex/raboot, https://pokemondb.net/pokedex/cinderace"
Melmetal,809,800.0 kg,250.0 cm,Steel,Iron Fist, Boosts the power of punching moves., https://pokemondb.net/ability/iron-fist,https://pokemondb.net/pokedex/melmetal,,,
Stakataka,805,820.0 kg,550.0 cm,"Rock,Steel",Beast Boost, The Pokémon boosts its most proficient stat each time it knocks out a Pokémon., https://pokemondb.net/ability/beast-boost,https://pokemondb.net/pokedex/stakataka,,,
Meltan,808,8.0 kg,20.0 cm,Steel,Magnet Pull, Prevents Steel-type Pokémon from escaping., https://pokemondb.net/ability/magnet-pull,https://pokemondb.net/pokedex/meltan,Melmetal, #0809, https://pokemondb.net/pokedex/melmetal
Zeraora,807,44.5 kg,150.0 cm,Electric,Volt Absorb, Restores HP if hit by an Electric-type move., https://pokemondb.net/ability/volt-absorb,https://pokemondb.net/pokedex/zeraora,,,
Naganadel,804,150.0 kg,360.0 cm,"Poison,Dragon",Beast Boost, The Pokémon boosts its most proficient stat each time it knocks out a Pokémon., https://pokemondb.net/ability/beast-boost,https://pokemondb.net/pokedex/naganadel,,,
Poipole,803,1.8 kg,60.0 cm,Poison,Beast Boost, The Pokémon boosts its most proficient stat each time it knocks out a Pokémon., https://pokemondb.net/ability/beast-boost,https://pokemondb.net/pokedex/poipole,Naganadel, #0804, https://pokemondb.net/pokedex/naganadel
Blacephalon,806,13.0 kg,180.0 cm,"Fire,Ghost",Beast Boost, The Pokémon boosts its most proficient stat each time it knocks out a Pokémon., https://pokemondb.net/ability/beast-boost,https://pokemondb.net/pokedex/blacephalon,,,
Grookey,810,5.0 kg,30.0 cm,Grass,"Overgrow,Grassy Surge"," Powers up Grass-type moves in a pinch., The Pokémon creates a Grassy Terrain when it enters a battle."," https://pokemondb.net/ability/overgrow, https://pokemondb.net/ability/grassy-surge",https://pokemondb.net/pokedex/grookey,"Thwackey,Rillaboom"," #0811, #0812"," https://pokemondb.net/pokedex/thwackey, https://pokemondb.net/pokedex/rillaboom"
Celesteela,797,999.9 kg,919.9999999999999 cm,"Steel,Flying",Beast Boost, The Pokémon boosts its most proficient stat each time it knocks out a Pokémon., https://pokemondb.net/ability/beast-boost,https://pokemondb.net/pokedex/celesteela,,,
Marshadow,802,22.2 kg,70.0 cm,"Fighting,Ghost",Technician, Powers up the Pokémon's weaker moves., https://pokemondb.net/ability/technician,https://pokemondb.net/pokedex/marshadow,,,
Pheromosa,795,25.0 kg,180.0 cm,"Bug,Fighting",Beast Boost, The Pokémon boosts its most proficient stat each time it knocks out a Pokémon., https://pokemondb.net/ability/beast-boost,https://pokemondb.net/pokedex/pheromosa,,,
Necrozma,800,230.0 kg,240.0 cm,Psychic,"Prism Armor,Prism Armor,Prism Armor,Neuroforce"," Reduces damage from super-effective attacks., Reduces damage from super-effective attacks., Reduces damage from super-effective attacks., Powers up moves that are super effective."," https://pokemondb.net/ability/prism-armor, https://pokemondb.net/ability/prism-armor, https://pokemondb.net/ability/prism-armor, https://pokemondb.net/ability/neuroforce",https://pokemondb.net/pokedex/necrozma,,,
Xurkitree,796,100.0 kg,380.0 cm,Electric,Beast Boost, The Pokémon boosts its most proficient stat each time it knocks out a Pokémon., https://pokemondb.net/ability/beast-boost,https://pokemondb.net/pokedex/xurkitree,,,
Guzzlord,799,888.0 kg,550.0 cm,"Dark,Dragon",Beast Boost, The Pokémon boosts its most proficient stat each time it knocks out a Pokémon., https://pokemondb.net/ability/beast-boost,https://pokemondb.net/pokedex/guzzlord,,,
Magearna,801,80.5 kg,100.0 cm,"Steel,Fairy",Soul-Heart, Raises Special Attack when another Pokémon faints., https://pokemondb.net/ability/soul-heart,https://pokemondb.net/pokedex/magearna,,,
Kartana,798,0.1 kg,30.0 cm,"Grass,Steel",Beast Boost, The Pokémon boosts its most proficient stat each time it knocks out a Pokémon., https://pokemondb.net/ability/beast-boost,https://pokemondb.net/pokedex/kartana,,,
Lunala,792,120.0 kg,400.0 cm,"Psychic,Ghost",Shadow Shield, Reduces damage when HP is full., https://pokemondb.net/ability/shadow-shield,https://pokemondb.net/pokedex/lunala,Cosmoem, #0790, https://pokemondb.net/pokedex/cosmoem
Solgaleo,791,230.0 kg,340.0 cm,"Psychic,Steel",Full Metal Body, Prevents other Pokémon from lowering its stats., https://pokemondb.net/ability/full-metal-body,https://pokemondb.net/pokedex/solgaleo,Cosmoem, #0790, https://pokemondb.net/pokedex/cosmoem
Cosmog,789,0.1 kg,20.0 cm,Psychic,Unaware, Ignores any stat changes in the Pokémon., https://pokemondb.net/ability/unaware,https://pokemondb.net/pokedex/cosmog,Cosmoem, #0790, https://pokemondb.net/pokedex/cosmoem
Tapu Fini,788,21.2 kg,130.0 cm,"Water,Fairy","Misty Surge,Telepathy"," The Pokémon creates a Misty Terrain when it enters a battle., Anticipates an ally's attack and dodges it."," https://pokemondb.net/ability/misty-surge, https://pokemondb.net/ability/telepathy",https://pokemondb.net/pokedex/tapu-fini,,,
Tapu Bulu,787,45.5 kg,190.0 cm,"Grass,Fairy","Grassy Surge,Telepathy"," The Pokémon creates a Grassy Terrain when it enters a battle., Anticipates an ally's attack and dodges it."," https://pokemondb.net/ability/grassy-surge, https://pokemondb.net/ability/telepathy",https://pokemondb.net/pokedex/tapu-bulu,,,
Buzzwole,794,333.6 kg,240.0 cm,"Bug,Fighting",Beast Boost, The Pokémon boosts its most proficient stat each time it knocks out a Pokémon., https://pokemondb.net/ability/beast-boost,https://pokemondb.net/pokedex/buzzwole,,,
Nihilego,793,55.5 kg,120.0 cm,"Rock,Poison",Beast Boost, The Pokémon boosts its most proficient stat each time it knocks out a Pokémon., https://pokemondb.net/ability/beast-boost,https://pokemondb.net/pokedex/nihilego,,,
Tapu Lele,786,18.6 kg,120.0 cm,"Psychic,Fairy","Psychic Surge,Telepathy"," The Pokémon creates a Psychic Terrain when it enters a battle., Anticipates an ally's attack and dodges it."," https://pokemondb.net/ability/psychic-surge, https://pokemondb.net/ability/telepathy",https://pokemondb.net/pokedex/tapu-lele,,,
Cosmoem,790,999.9 kg,10.0 cm,Psychic,Sturdy, It cannot be knocked out with one hit., https://pokemondb.net/ability/sturdy,https://pokemondb.net/pokedex/cosmoem,,,
Tapu Koko,785,20.5 kg,180.0 cm,"Electric,Fairy","Electric Surge,Telepathy"," The Pokémon creates an Electric Terrain when it enters a battle., Anticipates an ally's attack and dodges it."," https://pokemondb.net/ability/electric-surge, https://pokemondb.net/ability/telepathy",https://pokemondb.net/pokedex/tapu-koko,,,
Hakamo-o,783,47.0 kg,120.0 cm,"Dragon,Fighting","Bulletproof,Soundproof,Overcoat"," Protects the Pokémon from ball and bomb moves., Gives immunity to sound-based moves., Protects the Pokémon from weather damage."," https://pokemondb.net/ability/bulletproof, https://pokemondb.net/ability/soundproof, https://pokemondb.net/ability/overcoat",https://pokemondb.net/pokedex/hakamo-o,Kommo-o, #0784," https://pokemondb.net/pokedex/hakamo-o, https://pokemondb.net/pokedex/kommo-o"
Jangmo-o,782,29.7 kg,60.0 cm,Dragon,"Bulletproof,Soundproof,Overcoat"," Protects the Pokémon from ball and bomb moves., Gives immunity to sound-based moves., Protects the Pokémon from weather damage."," https://pokemondb.net/ability/bulletproof, https://pokemondb.net/ability/soundproof, https://pokemondb.net/ability/overcoat",https://pokemondb.net/pokedex/jangmo-o,"Hakamo-o,Kommo-o"," #0783, #0784"," https://pokemondb.net/pokedex/hakamo-o, https://pokemondb.net/pokedex/kommo-o"
Kommo-o,784,78.2 kg,160.0 cm,"Dragon,Fighting","Bulletproof,Soundproof,Overcoat"," Protects the Pokémon from ball and bomb moves., Gives immunity to sound-based moves., Protects the Pokémon from weather damage."," https://pokemondb.net/ability/bulletproof, https://pokemondb.net/ability/soundproof, https://pokemondb.net/ability/overcoat",https://pokemondb.net/pokedex/kommo-o,,,
Drampa,780,185.0 kg,300.0 cm,"Normal,Dragon","Berserk,Sap Sipper,Cloud Nine"," Raises Special Attack when HP drops below half., Boosts Attack when hit by a Grass-type move., Eliminates the effects of weather."," https://pokemondb.net/ability/berserk, https://pokemondb.net/ability/sap-sipper, https://pokemondb.net/ability/cloud-nine",https://pokemondb.net/pokedex/drampa,,,
Minior,774,40.0 kg,30.0 cm,"Rock,Flying","Shields Down,Shields Down"," Changes stats when HP drops below half., Changes stats when HP drops below half."," https://pokemondb.net/ability/shields-down, https://pokemondb.net/ability/shields-down",https://pokemondb.net/pokedex/minior,,,
Mimikyu,778,0.7 kg,20.0 cm,"Ghost,Fairy",Disguise, Avoids damage for one turn., https://pokemondb.net/ability/disguise,https://pokemondb.net/pokedex/mimikyu,,,
Turtonator,776,212.0 kg,200.0 cm,"Fire,Dragon",Shell Armor, The Pokémon is protected against critical hits., https://pokemondb.net/ability/shell-armor,https://pokemondb.net/pokedex/turtonator,,,
Dhelmise,781,210.0 kg,390.0 cm,"Ghost,Grass",Steelworker, Powers up Steel-type moves., https://pokemondb.net/ability/steelworker,https://pokemondb.net/pokedex/dhelmise,,,
Togedemaru,777,3.3 kg,30.0 cm,"Electric,Steel","Iron Barbs,Lightning Rod,Sturdy"," Inflicts damage to the Pokémon on contact., Draws in all Electric-type moves to up Sp. Attack., It cannot be knocked out with one hit."," https://pokemondb.net/ability/iron-barbs, https://pokemondb.net/ability/lightning-rod, https://pokemondb.net/ability/sturdy",https://pokemondb.net/pokedex/togedemaru,,,
Golisopod,768,108.0 kg,200.0 cm,"Bug,Water",Emergency Exit, Switches out when HP falls below 50%., https://pokemondb.net/ability/emergency-exit,https://pokemondb.net/pokedex/golisopod,,,
Silvally,773,100.5 kg,229.99999999999997 cm,Normal,RKS System, Changes type depending on held item., https://pokemondb.net/ability/rks-system,https://pokemondb.net/pokedex/silvally,,,
Palossand,770,250.0 kg,130.0 cm,"Ghost,Ground","Water Compaction,Sand Veil"," Sharply raises Defense when hit by a Water-type move., Boosts the Pokémon's evasion in a sandstorm."," https://pokemondb.net/ability/water-compaction, https://pokemondb.net/ability/sand-veil",https://pokemondb.net/pokedex/palossand,,,
Bruxish,779,19.0 kg,90.0 cm,"Water,Psychic","Dazzling,Strong Jaw,Wonder Skin"," Protects the Pokémon from high-priority moves., Boosts the power of biting moves., Makes status-changing moves more likely to miss."," https://pokemondb.net/ability/dazzling, https://pokemondb.net/ability/strong-jaw, https://pokemondb.net/ability/wonder-skin",https://pokemondb.net/pokedex/bruxish,,,
Pyukumuku,771,1.2 kg,30.0 cm,Water,"Innards Out,Unaware"," Deals damage upon fainting., Ignores any stat changes in the Pokémon."," https://pokemondb.net/ability/innards-out, https://pokemondb.net/ability/unaware",https://pokemondb.net/pokedex/pyukumuku,,,
Sandygast,769,70.0 kg,50.0 cm,"Ghost,Ground","Water Compaction,Sand Veil"," Sharply raises Defense when hit by a Water-type move., Boosts the Pokémon's evasion in a sandstorm."," https://pokemondb.net/ability/water-compaction, https://pokemondb.net/ability/sand-veil",https://pokemondb.net/pokedex/sandygast,Palossand, #0770, https://pokemondb.net/pokedex/palossand
Komala,775,19.9 kg,40.0 cm,Normal,Comatose, The Pokémon is always asleep but can still attack., https://pokemondb.net/ability/comatose,https://pokemondb.net/pokedex/komala,,,
Type: Null,772,120.5 kg,190.0 cm,Normal,Battle Armor, The Pokémon is protected against critical hits., https://pokemondb.net/ability/battle-armor,https://pokemondb.net/pokedex/type-null,Silvally, #0773, https://pokemondb.net/pokedex/silvally
Wimpod,767,12.0 kg,50.0 cm,"Bug,Water",Wimp Out, Switches out when HP drops below half., https://pokemondb.net/ability/wimp-out,https://pokemondb.net/pokedex/wimpod,Golisopod, #0768, https://pokemondb.net/pokedex/golisopod
Passimian,766,82.8 kg,200.0 cm,Fighting,"Receiver,Defiant"," Inherits an ally's ability when it faints., Sharply raises Attack when the Pokémon's stats are lowered."," https://pokemondb.net/ability/receiver, https://pokemondb.net/ability/defiant",https://pokemondb.net/pokedex/passimian,,,
Oranguru,765,76.0 kg,150.0 cm,"Normal,Psychic","Inner Focus,Telepathy,Symbiosis"," The Pokémon is protected from flinching., Anticipates an ally's attack and dodges it., The Pokémon can pass an item to an ally."," https://pokemondb.net/ability/inner-focus, https://pokemondb.net/ability/telepathy, https://pokemondb.net/ability/symbiosis",https://pokemondb.net/pokedex/oranguru,,,
Comfey,764,0.3 kg,10.0 cm,Fairy,"Flower Veil,Triage,Natural Cure"," Prevents lowering of ally Grass-type Pokémon's stats., Gives priority to restorative moves., All status problems heal when it switches out."," https://pokemondb.net/ability/flower-veil, https://pokemondb.net/ability/triage, https://pokemondb.net/ability/natural-cure",https://pokemondb.net/pokedex/comfey,,,
Tsareena,763,21.4 kg,120.0 cm,Grass,"Leaf Guard,Queenly Majesty,Sweet Veil"," Prevents problems with status in sunny weather., Prevents use of priority moves., Prevents the Pokémon and allies from falling asleep."," https://pokemondb.net/ability/leaf-guard, https://pokemondb.net/ability/queenly-majesty, https://pokemondb.net/ability/sweet-veil",https://pokemondb.net/pokedex/tsareena,,,
Bounsweet,761,3.2 kg,30.0 cm,Grass,"Leaf Guard,Oblivious,Sweet Veil"," Prevents problems with status in sunny weather., Prevents it from becoming infatuated., Prevents the Pokémon and allies from falling asleep."," https://pokemondb.net/ability/leaf-guard, https://pokemondb.net/ability/oblivious, https://pokemondb.net/ability/sweet-veil",https://pokemondb.net/pokedex/bounsweet,"Steenee,Tsareena"," #0762, #0763"," https://pokemondb.net/pokedex/steenee, https://pokemondb.net/pokedex/tsareena"
Steenee,762,8.2 kg,70.0 cm,Grass,"Leaf Guard,Oblivious,Sweet Veil"," Prevents problems with status in sunny weather., Prevents it from becoming infatuated., Prevents the Pokémon and allies from falling asleep."," https://pokemondb.net/ability/leaf-guard, https://pokemondb.net/ability/oblivious, https://pokemondb.net/ability/sweet-veil",https://pokemondb.net/pokedex/steenee,Tsareena, #0763," https://pokemondb.net/pokedex/steenee, https://pokemondb.net/pokedex/tsareena"
Fomantis,753,1.5 kg,30.0 cm,Grass,"Leaf Guard,Contrary"," Prevents problems with status in sunny weather., Makes stat changes have an opposite effect."," https://pokemondb.net/ability/leaf-guard, https://pokemondb.net/ability/contrary",https://pokemondb.net/pokedex/fomantis,Lurantis, #0754, https://pokemondb.net/pokedex/lurantis
Araquanid,752,82.0 kg,180.0 cm,"Water,Bug","Water Bubble,Water Absorb"," Halves damage from Fire-type moves, doubles power of Water-type moves used, and prevents burns., Restores HP if hit by a Water-type move."," https://pokemondb.net/ability/water-bubble, https://pokemondb.net/ability/water-absorb",https://pokemondb.net/pokedex/araquanid,,,
Dewpider,751,4.0 kg,30.0 cm,"Water,Bug","Water Bubble,Water Absorb"," Halves damage from Fire-type moves, doubles power of Water-type moves used, and prevents burns., Restores HP if hit by a Water-type move."," https://pokemondb.net/ability/water-bubble, https://pokemondb.net/ability/water-absorb",https://pokemondb.net/pokedex/dewpider,Araquanid, #0752, https://pokemondb.net/pokedex/araquanid
Toxapex,748,14.5 kg,70.0 cm,"Poison,Water","Merciless,Limber,Regenerator"," The Pokémon's attacks become critical hits if the target is poisoned., The Pokémon is protected from paralysis., Restores a little HP when withdrawn from battle."," https://pokemondb.net/ability/merciless, https://pokemondb.net/ability/limber, https://pokemondb.net/ability/regenerator",https://pokemondb.net/pokedex/toxapex,,,
Mudsdale,750,920.0 kg,250.0 cm,Ground,"Own Tempo,Stamina,Inner Focus"," Prevents the Pokémon from becoming confused., Raises Defense when attacked., The Pokémon is protected from flinching."," https://pokemondb.net/ability/own-tempo, https://pokemondb.net/ability/stamina, https://pokemondb.net/ability/inner-focus",https://pokemondb.net/pokedex/mudsdale,,,
Mudbray,749,110.0 kg,100.0 cm,Ground,"Own Tempo,Stamina,Inner Focus"," Prevents the Pokémon from becoming confused., Raises Defense when attacked., The Pokémon is protected from flinching."," https://pokemondb.net/ability/own-tempo, https://pokemondb.net/ability/stamina, https://pokemondb.net/ability/inner-focus",https://pokemondb.net/pokedex/mudbray,Mudsdale, #0750, https://pokemondb.net/pokedex/mudsdale
Mareanie,747,8.0 kg,40.0 cm,"Poison,Water","Merciless,Limber,Regenerator"," The Pokémon's attacks become critical hits if the target is poisoned., The Pokémon is protected from paralysis., Restores a little HP when withdrawn from battle."," https://pokemondb.net/ability/merciless, https://pokemondb.net/ability/limber, https://pokemondb.net/ability/regenerator",https://pokemondb.net/pokedex/mareanie,Toxapex, #0748, https://pokemondb.net/pokedex/toxapex
Wishiwashi,746,0.3 kg,20.0 cm,Water,"Schooling,Schooling"," Changes Wishiwashi to School Form., Changes Wishiwashi to School Form."," https://pokemondb.net/ability/schooling, https://pokemondb.net/ability/schooling",https://pokemondb.net/pokedex/wishiwashi,,,
Lycanroc,745,25.0 kg,80.0 cm,Rock,"Keen Eye,Sand Rush,Steadfast,Keen Eye,Vital Spirit,No Guard,Tough Claws"," Prevents other Pokémon from lowering accuracy., Boosts the Pokémon's Speed in a sandstorm., Raises Speed each time the Pokémon flinches., Prevents other Pokémon from lowering accuracy., Prevents the Pokémon from falling asleep., Ensures attacks by or against the Pokémon land., Boosts the power of contact moves."," https://pokemondb.net/ability/keen-eye, https://pokemondb.net/ability/sand-rush, https://pokemondb.net/ability/steadfast, https://pokemondb.net/ability/keen-eye, https://pokemondb.net/ability/vital-spirit, https://pokemondb.net/ability/no-guard, https://pokemondb.net/ability/tough-claws",https://pokemondb.net/pokedex/lycanroc,,,
Vikavolt,738,45.0 kg,150.0 cm,"Bug,Electric",Levitate, Gives immunity to Ground type moves., https://pokemondb.net/ability/levitate,https://pokemondb.net/pokedex/vikavolt,,,
Ribombee,743,0.5 kg,20.0 cm,"Bug,Fairy","Honey Gather,Shield Dust,Sweet Veil"," The Pokémon may gather Honey from somewhere., Blocks the added effects of attacks taken., Prevents the Pokémon and allies from falling asleep."," https://pokemondb.net/ability/honey-gather, https://pokemondb.net/ability/shield-dust, https://pokemondb.net/ability/sweet-veil",https://pokemondb.net/pokedex/ribombee,,,
Rockruff,744,9.2 kg,50.0 cm,Rock,"Keen Eye,Vital Spirit,Steadfast,Own Tempo"," Prevents other Pokémon from lowering accuracy., Prevents the Pokémon from falling asleep., Raises Speed each time the Pokémon flinches., Prevents the Pokémon from becoming confused."," https://pokemondb.net/ability/keen-eye, https://pokemondb.net/ability/vital-spirit, https://pokemondb.net/ability/steadfast, https://pokemondb.net/ability/own-tempo",https://pokemondb.net/pokedex/rockruff,Lycanroc, #0745," https://pokemondb.net/pokedex/rockruff, https://pokemondb.net/pokedex/lycanroc"
Oricorio,741,3.4 kg,60.0 cm,"Fire,Flying","Dancer,Dancer,Dancer,Dancer"," Copies the foe's Dance moves., Copies the foe's Dance moves., Copies the foe's Dance moves., Copies the foe's Dance moves."," https://pokemondb.net/ability/dancer, https://pokemondb.net/ability/dancer, https://pokemondb.net/ability/dancer, https://pokemondb.net/ability/dancer",https://pokemondb.net/pokedex/oricorio,,,
Cutiefly,742,0.2 kg,10.0 cm,"Bug,Fairy","Honey Gather,Shield Dust,Sweet Veil"," The Pokémon may gather Honey from somewhere., Blocks the added effects of attacks taken., Prevents the Pokémon and allies from falling asleep."," https://pokemondb.net/ability/honey-gather, https://pokemondb.net/ability/shield-dust, https://pokemondb.net/ability/sweet-veil",https://pokemondb.net/pokedex/cutiefly,Ribombee, #0743, https://pokemondb.net/pokedex/ribombee
Crabominable,740,180.0 kg,170.0 cm,"Fighting,Ice","Hyper Cutter,Iron Fist,Anger Point"," Prevents other Pokémon from lowering Attack stat., Boosts the power of punching moves., Maxes Attack after taking a critical hit."," https://pokemondb.net/ability/hyper-cutter, https://pokemondb.net/ability/iron-fist, https://pokemondb.net/ability/anger-point",https://pokemondb.net/pokedex/crabominable,,,
Charjabug,737,10.5 kg,50.0 cm,"Bug,Electric",Battery, Raises power of teammates' Special moves., https://pokemondb.net/ability/battery,https://pokemondb.net/pokedex/charjabug,Vikavolt, #0738," https://pokemondb.net/pokedex/charjabug, https://pokemondb.net/pokedex/vikavolt"
Grubbin,736,4.4 kg,40.0 cm,Bug,Swarm, Powers up Bug-type moves in a pinch., https://pokemondb.net/ability/swarm,https://pokemondb.net/pokedex/grubbin,"Charjabug,Vikavolt"," #0737, #0738"," https://pokemondb.net/pokedex/charjabug, https://pokemondb.net/pokedex/vikavolt"
