Nome,Número,Peso,Altura,Tipos,Habilidades,Habilidades Descrição,Habilidades URL,Url Pokémon,Evoluções,Evoluções Número,Evoluções URL
Pansage,511,10.5 kg,60.0 cm,Grass,"Gluttony,Overgrow"," Encourages the early use of a held Berry., Powers up Grass-type moves in a pinch."," https://pokemondb.net/ability/gluttony, https://pokemondb.net/ability/overgrow",https://pokemondb.net/pokedex/pansage,Simisage, #0512, https://pokemondb.net/pokedex/simisage
Liepard,510,37.5 kg,110.00000000000001 cm,Dark,"Limber,Unburden,Prankster"," The Pokémon is protected from paralysis., Raises Speed if a held item is used., Gives priority to a status move."," https://pokemondb.net/ability/limber, https://pokemondb.net/ability/unburden, https://pokemondb.net/ability/prankster",https://pokemondb.net/pokedex/liepard,,,
Purrloin,509,10.1 kg,40.0 cm,Dark,"Limber,Unburden,Prankster"," The Pokémon is protected from paralysis., Raises Speed if a held item is used., Gives priority to a status move."," https://pokemondb.net/ability/limber, https://pokemondb.net/ability/unburden, https://pokemondb.net/ability/prankster",https://pokemondb.net/pokedex/purrloin,Liepard, #0510, https://pokemondb.net/pokedex/liepard
Stoutland,508,61.0 kg,120.0 cm,Normal,"Intimidate,Sand Rush,Scrappy"," Lowers the foe's Attack stat., Boosts the Pokémon's Speed in a sandstorm., Enables moves to hit Ghost-type Pokémon."," https://pokemondb.net/ability/intimidate, https://pokemondb.net/ability/sand-rush, https://pokemondb.net/ability/scrappy",https://pokemondb.net/pokedex/stoutland,,,
Patrat,504,11.6 kg,50.0 cm,Normal,"Run Away,Keen Eye,Analytic"," Enables a sure getaway from wild Pokémon., Prevents other Pokémon from lowering accuracy., Boosts move power when the Pokémon moves last."," https://pokemondb.net/ability/run-away, https://pokemondb.net/ability/keen-eye, https://pokemondb.net/ability/analytic",https://pokemondb.net/pokedex/patrat,Watchog, #0505, https://pokemondb.net/pokedex/watchog
Samurott,503,94.6 kg,150.0 cm,Water,"Torrent,Shell Armor,Torrent,Sharpness"," Powers up Water-type moves in a pinch., The Pokémon is protected against critical hits., Powers up Water-type moves in a pinch., Boosts the power of slicing moves."," https://pokemondb.net/ability/torrent, https://pokemondb.net/ability/shell-armor, https://pokemondb.net/ability/torrent, https://pokemondb.net/ability/sharpness",https://pokemondb.net/pokedex/samurott,Dewott, #0502, https://pokemondb.net/pokedex/dewott
Dewott,502,24.5 kg,80.0 cm,Water,"Torrent,Shell Armor"," Powers up Water-type moves in a pinch., The Pokémon is protected against critical hits."," https://pokemondb.net/ability/torrent, https://pokemondb.net/ability/shell-armor",https://pokemondb.net/pokedex/dewott,,,
Oshawott,501,5.9 kg,50.0 cm,Water,"Torrent,Shell Armor"," Powers up Water-type moves in a pinch., The Pokémon is protected against critical hits."," https://pokemondb.net/ability/torrent, https://pokemondb.net/ability/shell-armor",https://pokemondb.net/pokedex/oshawott,Dewott, #0502, https://pokemondb.net/pokedex/dewott
Emboar,500,150.0 kg,160.0 cm,"Fire,Fighting","Blaze,Reckless"," Powers up Fire-type moves in a pinch., Powers up moves that have recoil damage."," https://pokemondb.net/ability/blaze, https://pokemondb.net/ability/reckless",https://pokemondb.net/pokedex/emboar,,,
Pignite,499,55.5 kg,100.0 cm,"Fire,Fighting","Blaze,Thick Fat"," Powers up Fire-type moves in a pinch., Ups resistance to Fire- and Ice-type moves."," https://pokemondb.net/ability/blaze, https://pokemondb.net/ability/thick-fat",https://pokemondb.net/pokedex/pignite,Emboar, #0500," https://pokemondb.net/pokedex/pignite, https://pokemondb.net/pokedex/emboar"
Serperior,497,63.0 kg,330.0 cm,Grass,"Overgrow,Contrary"," Powers up Grass-type moves in a pinch., Makes stat changes have an opposite effect."," https://pokemondb.net/ability/overgrow, https://pokemondb.net/ability/contrary",https://pokemondb.net/pokedex/serperior,,,
Servine,496,16.0 kg,80.0 cm,Grass,"Overgrow,Contrary"," Powers up Grass-type moves in a pinch., Makes stat changes have an opposite effect."," https://pokemondb.net/ability/overgrow, https://pokemondb.net/ability/contrary",https://pokemondb.net/pokedex/servine,Serperior, #0497," https://pokemondb.net/pokedex/servine, https://pokemondb.net/pokedex/serperior"
Tepig,498,9.9 kg,50.0 cm,Fire,"Blaze,Thick Fat"," Powers up Fire-type moves in a pinch., Ups resistance to Fire- and Ice-type moves."," https://pokemondb.net/ability/blaze, https://pokemondb.net/ability/thick-fat",https://pokemondb.net/pokedex/tepig,"Pignite,Emboar"," #0499, #0500"," https://pokemondb.net/pokedex/pignite, https://pokemondb.net/pokedex/emboar"
Arceus,493,320.0 kg,320.0 cm,Normal,Multitype, Changes type to match the held Plate., https://pokemondb.net/ability/multitype,https://pokemondb.net/pokedex/arceus,,,
Snivy,495,8.1 kg,60.0 cm,Grass,"Overgrow,Contrary"," Powers up Grass-type moves in a pinch., Makes stat changes have an opposite effect."," https://pokemondb.net/ability/overgrow, https://pokemondb.net/ability/contrary",https://pokemondb.net/pokedex/snivy,"Servine,Serperior"," #0496, #0497"," https://pokemondb.net/pokedex/servine, https://pokemondb.net/pokedex/serperior"
Victini,494,4.0 kg,40.0 cm,"Psychic,Fire",Victory Star, Boosts the accuracy of its allies and itself., https://pokemondb.net/ability/victory-star,https://pokemondb.net/pokedex/victini,,,
Shaymin,492,2.1 kg,20.0 cm,Grass,"Natural Cure,Serene Grace"," All status problems heal when it switches out., Boosts the likelihood of added effects appearing."," https://pokemondb.net/ability/natural-cure, https://pokemondb.net/ability/serene-grace",https://pokemondb.net/pokedex/shaymin,,,
Darkrai,491,50.5 kg,150.0 cm,Dark,Bad Dreams, Reduces a sleeping foe's HP., https://pokemondb.net/ability/bad-dreams,https://pokemondb.net/pokedex/darkrai,,,
Cresselia,488,85.6 kg,150.0 cm,Psychic,Levitate, Gives immunity to Ground type moves., https://pokemondb.net/ability/levitate,https://pokemondb.net/pokedex/cresselia,,,
Manaphy,490,1.4 kg,30.0 cm,Water,Hydration, Heals status problems if it is raining., https://pokemondb.net/ability/hydration,https://pokemondb.net/pokedex/manaphy,,,
Phione,489,3.1 kg,40.0 cm,Water,Hydration, Heals status problems if it is raining., https://pokemondb.net/ability/hydration,https://pokemondb.net/pokedex/phione,,,
Giratina,487,750.0 kg,450.0 cm,"Ghost,Dragon","Pressure,Telepathy,Levitate"," The Pokémon raises the foe's PP usage., Anticipates an ally's attack and dodges it., Gives immunity to Ground type moves."," https://pokemondb.net/ability/pressure, https://pokemondb.net/ability/telepathy, https://pokemondb.net/ability/levitate",https://pokemondb.net/pokedex/giratina,,,
Regigigas,486,420.0 kg,370.0 cm,Normal,Slow Start, Temporarily halves Attack and Speed., https://pokemondb.net/ability/slow-start,https://pokemondb.net/pokedex/regigigas,,,
Heatran,485,430.0 kg,170.0 cm,"Fire,Steel","Flash Fire,Flame Body"," It powers up Fire-type moves if it's hit by one., Contact with the Pokémon may burn the attacker."," https://pokemondb.net/ability/flash-fire, https://pokemondb.net/ability/flame-body",https://pokemondb.net/pokedex/heatran,,,
Uxie,480,0.3 kg,30.0 cm,Psychic,Levitate, Gives immunity to Ground type moves., https://pokemondb.net/ability/levitate,https://pokemondb.net/pokedex/uxie,,,
Rotom,479,0.3 kg,30.0 cm,"Electric,Ghost","Levitate,Levitate,Levitate,Levitate,Levitate,Levitate"," Gives immunity to Ground type moves., Gives immunity to Ground type moves., Gives immunity to Ground type moves., Gives immunity to Ground type moves., Gives immunity to Ground type moves., Gives immunity to Ground type moves."," https://pokemondb.net/ability/levitate, https://pokemondb.net/ability/levitate, https://pokemondb.net/ability/levitate, https://pokemondb.net/ability/levitate, https://pokemondb.net/ability/levitate, https://pokemondb.net/ability/levitate",https://pokemondb.net/pokedex/rotom,,,
Froslass,478,26.6 kg,130.0 cm,"Ice,Ghost","Snow Cloak,Cursed Body"," Raises evasion in a hailstorm., May disable a move used on the Pokémon."," https://pokemondb.net/ability/snow-cloak, https://pokemondb.net/ability/cursed-body",https://pokemondb.net/pokedex/froslass,,,
Dusknoir,477,106.6 kg,220.00000000000003 cm,Ghost,"Pressure,Frisk"," The Pokémon raises the foe's PP usage., The Pokémon can check a foe's held item."," https://pokemondb.net/ability/pressure, https://pokemondb.net/ability/frisk",https://pokemondb.net/pokedex/dusknoir,,,
Probopass,476,340.0 kg,140.0 cm,"Rock,Steel","Sturdy,Magnet Pull,Sand Force"," It cannot be knocked out with one hit., Prevents Steel-type Pokémon from escaping., Boosts certain moves' power in a sandstorm."," https://pokemondb.net/ability/sturdy, https://pokemondb.net/ability/magnet-pull, https://pokemondb.net/ability/sand-force",https://pokemondb.net/pokedex/probopass,,,
Gallade,475,52.0 kg,160.0 cm,"Psychic,Fighting","Steadfast,Sharpness,Justified,Inner Focus"," Raises Speed each time the Pokémon flinches., Boosts the power of slicing moves., Raises Attack when hit by a Dark-type move., The Pokémon is protected from flinching."," https://pokemondb.net/ability/steadfast, https://pokemondb.net/ability/sharpness, https://pokemondb.net/ability/justified, https://pokemondb.net/ability/inner-focus",https://pokemondb.net/pokedex/gallade,Kirlia, #0281, https://pokemondb.net/pokedex/kirlia
Porygon-Z,474,34.0 kg,90.0 cm,Normal,"Adaptability,Download,Analytic"," Powers up moves of the same type., Adjusts power according to a foe's defenses., Boosts move power when the Pokémon moves last."," https://pokemondb.net/ability/adaptability, https://pokemondb.net/ability/download, https://pokemondb.net/ability/analytic",https://pokemondb.net/pokedex/porygon-z,,,
Mamoswine,473,291.0 kg,250.0 cm,"Ice,Ground","Oblivious,Snow Cloak,Thick Fat"," Prevents it from becoming infatuated., Raises evasion in a hailstorm., Ups resistance to Fire- and Ice-type moves."," https://pokemondb.net/ability/oblivious, https://pokemondb.net/ability/snow-cloak, https://pokemondb.net/ability/thick-fat",https://pokemondb.net/pokedex/mamoswine,,,
Leafeon,470,25.5 kg,100.0 cm,Grass,"Leaf Guard,Chlorophyll"," Prevents problems with status in sunny weather., Boosts the Pokémon's Speed in sunshine."," https://pokemondb.net/ability/leaf-guard, https://pokemondb.net/ability/chlorophyll",https://pokemondb.net/pokedex/leafeon,,,
Togekiss,468,38.0 kg,150.0 cm,"Fairy,Flying","Hustle,Serene Grace,Super Luck"," Boosts the Attack stat, but lowers accuracy., Boosts the likelihood of added effects appearing., Heightens the critical-hit ratios of moves."," https://pokemondb.net/ability/hustle, https://pokemondb.net/ability/serene-grace, https://pokemondb.net/ability/super-luck",https://pokemondb.net/pokedex/togekiss,,,
Electivire,466,138.6 kg,180.0 cm,Electric,"Motor Drive,Vital Spirit"," Raises Speed if hit by an Electric-type move., Prevents the Pokémon from falling asleep."," https://pokemondb.net/ability/motor-drive, https://pokemondb.net/ability/vital-spirit",https://pokemondb.net/pokedex/electivire,,,
Yanmega,469,51.5 kg,190.0 cm,"Bug,Flying","Speed Boost,Tinted Lens,Frisk"," Its Speed stat is gradually boosted., Powers up “not very effective” moves., The Pokémon can check a foe's held item."," https://pokemondb.net/ability/speed-boost, https://pokemondb.net/ability/tinted-lens, https://pokemondb.net/ability/frisk",https://pokemondb.net/pokedex/yanmega,,,
Gliscor,472,42.5 kg,200.0 cm,"Ground,Flying","Hyper Cutter,Sand Veil,Poison Heal"," Prevents other Pokémon from lowering Attack stat., Boosts the Pokémon's evasion in a sandstorm., Restores HP if the Pokémon is poisoned."," https://pokemondb.net/ability/hyper-cutter, https://pokemondb.net/ability/sand-veil, https://pokemondb.net/ability/poison-heal",https://pokemondb.net/pokedex/gliscor,,,
Glaceon,471,25.9 kg,80.0 cm,Ice,"Snow Cloak,Ice Body"," Raises evasion in a hailstorm., The Pokémon gradually regains HP in a hailstorm."," https://pokemondb.net/ability/snow-cloak, https://pokemondb.net/ability/ice-body",https://pokemondb.net/pokedex/glaceon,,,
Magmortar,467,68.0 kg,160.0 cm,Fire,"Flame Body,Vital Spirit"," Contact with the Pokémon may burn the attacker., Prevents the Pokémon from falling asleep."," https://pokemondb.net/ability/flame-body, https://pokemondb.net/ability/vital-spirit",https://pokemondb.net/pokedex/magmortar,,,
Tangrowth,465,128.6 kg,200.0 cm,Grass,"Chlorophyll,Leaf Guard,Regenerator"," Boosts the Pokémon's Speed in sunshine., Prevents problems with status in sunny weather., Restores a little HP when withdrawn from battle."," https://pokemondb.net/ability/chlorophyll, https://pokemondb.net/ability/leaf-guard, https://pokemondb.net/ability/regenerator",https://pokemondb.net/pokedex/tangrowth,,,
Snover,459,50.5 kg,100.0 cm,"Grass,Ice","Snow Warning,Soundproof"," The Pokémon summons a hailstorm in battle., Gives immunity to sound-based moves."," https://pokemondb.net/ability/snow-warning, https://pokemondb.net/ability/soundproof",https://pokemondb.net/pokedex/snover,Abomasnow, #0460, https://pokemondb.net/pokedex/abomasnow
Mantyke,458,65.0 kg,100.0 cm,"Water,Flying","Swift Swim,Water Absorb,Water Veil"," Boosts the Pokémon's Speed in rain., Restores HP if hit by a Water-type move., Prevents the Pokémon from getting a burn."," https://pokemondb.net/ability/swift-swim, https://pokemondb.net/ability/water-absorb, https://pokemondb.net/ability/water-veil",https://pokemondb.net/pokedex/mantyke,Mantine, #0226, https://pokemondb.net/pokedex/mantine
Rhyperior,464,282.8 kg,240.0 cm,"Ground,Rock","Lightning Rod,Solid Rock,Reckless"," Draws in all Electric-type moves to up Sp. Attack., Reduces damage from super-effective attacks., Powers up moves that have recoil damage."," https://pokemondb.net/ability/lightning-rod, https://pokemondb.net/ability/solid-rock, https://pokemondb.net/ability/reckless",https://pokemondb.net/pokedex/rhyperior,,,
Weavile,461,34.0 kg,110.00000000000001 cm,"Dark,Ice","Pressure,Pickpocket"," The Pokémon raises the foe's PP usage., Steals an item when hit by another Pokémon."," https://pokemondb.net/ability/pressure, https://pokemondb.net/ability/pickpocket",https://pokemondb.net/pokedex/weavile,"Sneasel,Sneasler"," #0215, #0903"," https://pokemondb.net/pokedex/weavile, https://pokemondb.net/pokedex/sneasel, https://pokemondb.net/pokedex/sneasler"
Magnezone,462,180.0 kg,120.0 cm,"Electric,Steel","Magnet Pull,Sturdy,Analytic"," Prevents Steel-type Pokémon from escaping., It cannot be knocked out with one hit., Boosts move power when the Pokémon moves last."," https://pokemondb.net/ability/magnet-pull, https://pokemondb.net/ability/sturdy, https://pokemondb.net/ability/analytic",https://pokemondb.net/pokedex/magnezone,,,
Lumineon,457,24.0 kg,120.0 cm,Water,"Swift Swim,Storm Drain,Water Veil"," Boosts the Pokémon's Speed in rain., Draws in all Water-type moves to up Sp. Attack., Prevents the Pokémon from getting a burn."," https://pokemondb.net/ability/swift-swim, https://pokemondb.net/ability/storm-drain, https://pokemondb.net/ability/water-veil",https://pokemondb.net/pokedex/lumineon,,,
Abomasnow,460,135.5 kg,220.00000000000003 cm,"Grass,Ice","Snow Warning,Soundproof,Snow Warning"," The Pokémon summons a hailstorm in battle., Gives immunity to sound-based moves., The Pokémon summons a hailstorm in battle."," https://pokemondb.net/ability/snow-warning, https://pokemondb.net/ability/soundproof, https://pokemondb.net/ability/snow-warning",https://pokemondb.net/pokedex/abomasnow,,,
Finneon,456,7.0 kg,40.0 cm,Water,"Swift Swim,Storm Drain,Water Veil"," Boosts the Pokémon's Speed in rain., Draws in all Water-type moves to up Sp. Attack., Prevents the Pokémon from getting a burn."," https://pokemondb.net/ability/swift-swim, https://pokemondb.net/ability/storm-drain, https://pokemondb.net/ability/water-veil",https://pokemondb.net/pokedex/finneon,Lumineon, #0457, https://pokemondb.net/pokedex/lumineon
Toxicroak,454,44.4 kg,130.0 cm,"Poison,Fighting","Anticipation,Dry Skin,Poison Touch"," Senses a foe's dangerous moves., Reduces HP if it is hot. Water restores HP., May poison targets when a Pokémon makes contact."," https://pokemondb.net/ability/anticipation, https://pokemondb.net/ability/dry-skin, https://pokemondb.net/ability/poison-touch",https://pokemondb.net/pokedex/toxicroak,,,
Lucario,448,54.0 kg,120.0 cm,"Fighting,Steel","Steadfast,Inner Focus,Justified,Adaptability"," Raises Speed each time the Pokémon flinches., The Pokémon is protected from flinching., Raises Attack when hit by a Dark-type move., Powers up moves of the same type."," https://pokemondb.net/ability/steadfast, https://pokemondb.net/ability/inner-focus, https://pokemondb.net/ability/justified, https://pokemondb.net/ability/adaptability",https://pokemondb.net/pokedex/lucario,,,
Skorupi,451,12.0 kg,80.0 cm,"Poison,Bug","Battle Armor,Sniper,Keen Eye"," The Pokémon is protected against critical hits., Powers up moves if they become critical hits., Prevents other Pokémon from lowering accuracy."," https://pokemondb.net/ability/battle-armor, https://pokemondb.net/ability/sniper, https://pokemondb.net/ability/keen-eye",https://pokemondb.net/pokedex/skorupi,Drapion, #0452, https://pokemondb.net/pokedex/drapion
Drapion,452,61.5 kg,130.0 cm,"Poison,Dark","Battle Armor,Sniper,Keen Eye"," The Pokémon is protected against critical hits., Powers up moves if they become critical hits., Prevents other Pokémon from lowering accuracy."," https://pokemondb.net/ability/battle-armor, https://pokemondb.net/ability/sniper, https://pokemondb.net/ability/keen-eye",https://pokemondb.net/pokedex/drapion,,,
Hippopotas,449,49.5 kg,80.0 cm,Ground,"Sand Stream,Sand Force"," The Pokémon summons a sandstorm in battle., Boosts certain moves' power in a sandstorm."," https://pokemondb.net/ability/sand-stream, https://pokemondb.net/ability/sand-force",https://pokemondb.net/pokedex/hippopotas,Hippowdon, #0450, https://pokemondb.net/pokedex/hippowdon
Carnivine,455,27.0 kg,140.0 cm,Grass,Levitate, Gives immunity to Ground type moves., https://pokemondb.net/ability/levitate,https://pokemondb.net/pokedex/carnivine,,,
Hippowdon,450,300.0 kg,200.0 cm,Ground,"Sand Stream,Sand Force"," The Pokémon summons a sandstorm in battle., Boosts certain moves' power in a sandstorm."," https://pokemondb.net/ability/sand-stream, https://pokemondb.net/ability/sand-force",https://pokemondb.net/pokedex/hippowdon,,,
Riolu,447,20.2 kg,70.0 cm,Fighting,"Steadfast,Inner Focus,Prankster"," Raises Speed each time the Pokémon flinches., The Pokémon is protected from flinching., Gives priority to a status move."," https://pokemondb.net/ability/steadfast, https://pokemondb.net/ability/inner-focus, https://pokemondb.net/ability/prankster",https://pokemondb.net/pokedex/riolu,Lucario, #0448, https://pokemondb.net/pokedex/lucario
Munchlax,446,105.0 kg,60.0 cm,Normal,"Pickup,Thick Fat,Gluttony"," The Pokémon may pick up items., Ups resistance to Fire- and Ice-type moves., Encourages the early use of a held Berry."," https://pokemondb.net/ability/pickup, https://pokemondb.net/ability/thick-fat, https://pokemondb.net/ability/gluttony",https://pokemondb.net/pokedex/munchlax,Snorlax, #0143, https://pokemondb.net/pokedex/snorlax
Croagunk,453,23.0 kg,70.0 cm,"Poison,Fighting","Anticipation,Dry Skin,Poison Touch"," Senses a foe's dangerous moves., Reduces HP if it is hot. Water restores HP., May poison targets when a Pokémon makes contact."," https://pokemondb.net/ability/anticipation, https://pokemondb.net/ability/dry-skin, https://pokemondb.net/ability/poison-touch",https://pokemondb.net/pokedex/croagunk,Toxicroak, #0454, https://pokemondb.net/pokedex/toxicroak
Gabite,444,56.0 kg,140.0 cm,"Dragon,Ground","Sand Veil,Rough Skin"," Boosts the Pokémon's evasion in a sandstorm., Inflicts damage to the attacker on contact."," https://pokemondb.net/ability/sand-veil, https://pokemondb.net/ability/rough-skin",https://pokemondb.net/pokedex/gabite,Garchomp, #0445," https://pokemondb.net/pokedex/gabite, https://pokemondb.net/pokedex/garchomp"
Garchomp,445,95.0 kg,190.0 cm,"Dragon,Ground","Sand Veil,Rough Skin,Sand Force"," Boosts the Pokémon's evasion in a sandstorm., Inflicts damage to the attacker on contact., Boosts certain moves' power in a sandstorm."," https://pokemondb.net/ability/sand-veil, https://pokemondb.net/ability/rough-skin, https://pokemondb.net/ability/sand-force",https://pokemondb.net/pokedex/garchomp,,,
Gible,443,20.5 kg,70.0 cm,"Dragon,Ground","Sand Veil,Rough Skin"," Boosts the Pokémon's evasion in a sandstorm., Inflicts damage to the attacker on contact."," https://pokemondb.net/ability/sand-veil, https://pokemondb.net/ability/rough-skin",https://pokemondb.net/pokedex/gible,"Gabite,Garchomp"," #0444, #0445"," https://pokemondb.net/pokedex/gabite, https://pokemondb.net/pokedex/garchomp"
Lopunny,428,33.3 kg,120.0 cm,Normal,"Cute Charm,Klutz,Limber,Scrappy"," Contact with the Pokémon may cause infatuation., The Pokémon can't use any held items., The Pokémon is protected from paralysis., Enables moves to hit Ghost-type Pokémon."," https://pokemondb.net/ability/cute-charm, https://pokemondb.net/ability/klutz, https://pokemondb.net/ability/limber, https://pokemondb.net/ability/scrappy",https://pokemondb.net/pokedex/lopunny,,,
Happiny,440,24.4 kg,60.0 cm,Normal,"Natural Cure,Serene Grace,Friend Guard"," All status problems heal when it switches out., Boosts the likelihood of added effects appearing., Reduces damage done to allies."," https://pokemondb.net/ability/natural-cure, https://pokemondb.net/ability/serene-grace, https://pokemondb.net/ability/friend-guard",https://pokemondb.net/pokedex/happiny,"Chansey,Blissey"," #0113, #0242"," https://pokemondb.net/pokedex/chansey, https://pokemondb.net/pokedex/blissey"
Bonsly,438,15.0 kg,50.0 cm,Rock,"Sturdy,Rock Head,Rattled"," It cannot be knocked out with one hit., Protects the Pokémon from recoil damage., Bug, Ghost or Dark type moves scare it and boost its Speed."," https://pokemondb.net/ability/sturdy, https://pokemondb.net/ability/rock-head, https://pokemondb.net/ability/rattled",https://pokemondb.net/pokedex/bonsly,Sudowoodo, #0185, https://pokemondb.net/pokedex/sudowoodo
Honchkrow,430,27.3 kg,90.0 cm,"Dark,Flying","Insomnia,Super Luck,Moxie"," Prevents the Pokémon from falling asleep., Heightens the critical-hit ratios of moves., Boosts Attack after knocking out any Pokémon."," https://pokemondb.net/ability/insomnia, https://pokemondb.net/ability/super-luck, https://pokemondb.net/ability/moxie",https://pokemondb.net/pokedex/honchkrow,,,
Mismagius,429,4.4 kg,90.0 cm,Ghost,Levitate, Gives immunity to Ground type moves., https://pokemondb.net/ability/levitate,https://pokemondb.net/pokedex/mismagius,,,
Spiritomb,442,108.0 kg,100.0 cm,"Ghost,Dark","Pressure,Infiltrator"," The Pokémon raises the foe's PP usage., Passes through the foe's barrier and strikes."," https://pokemondb.net/ability/pressure, https://pokemondb.net/ability/infiltrator",https://pokemondb.net/pokedex/spiritomb,,,
Chatot,441,1.9 kg,50.0 cm,"Normal,Flying","Keen Eye,Tangled Feet,Big Pecks"," Prevents other Pokémon from lowering accuracy., Raises evasion if the Pokémon is confused., Protects the Pokémon from Defense-lowering attacks."," https://pokemondb.net/ability/keen-eye, https://pokemondb.net/ability/tangled-feet, https://pokemondb.net/ability/big-pecks",https://pokemondb.net/pokedex/chatot,,,
Mime Jr.,439,13.0 kg,60.0 cm,"Psychic,Fairy","Soundproof,Filter,Technician"," Gives immunity to sound-based moves., Reduces damage from super-effective attacks., Powers up the Pokémon's weaker moves."," https://pokemondb.net/ability/soundproof, https://pokemondb.net/ability/filter, https://pokemondb.net/ability/technician",https://pokemondb.net/pokedex/mime-jr,,,
Buneary,427,5.5 kg,40.0 cm,Normal,"Run Away,Klutz,Limber"," Enables a sure getaway from wild Pokémon., The Pokémon can't use any held items., The Pokémon is protected from paralysis."," https://pokemondb.net/ability/run-away, https://pokemondb.net/ability/klutz, https://pokemondb.net/ability/limber",https://pokemondb.net/pokedex/buneary,Lopunny, #0428, https://pokemondb.net/pokedex/lopunny
Drifblim,426,15.0 kg,120.0 cm,"Ghost,Flying","Aftermath,Unburden,Flare Boost"," Damages the attacker landing the finishing hit., Raises Speed if a held item is used., Powers up special attacks when burned."," https://pokemondb.net/ability/aftermath, https://pokemondb.net/ability/unburden, https://pokemondb.net/ability/flare-boost",https://pokemondb.net/pokedex/drifblim,,,
Drifloon,425,1.2 kg,40.0 cm,"Ghost,Flying","Aftermath,Unburden,Flare Boost"," Damages the attacker landing the finishing hit., Raises Speed if a held item is used., Powers up special attacks when burned."," https://pokemondb.net/ability/aftermath, https://pokemondb.net/ability/unburden, https://pokemondb.net/ability/flare-boost",https://pokemondb.net/pokedex/drifloon,Drifblim, #0426, https://pokemondb.net/pokedex/drifblim
Gastrodon,423,29.9 kg,90.0 cm,"Water,Ground","Sticky Hold,Storm Drain,Sand Force"," Protects the Pokémon from item theft., Draws in all Water-type moves to up Sp. Attack., Boosts certain moves' power in a sandstorm."," https://pokemondb.net/ability/sticky-hold, https://pokemondb.net/ability/storm-drain, https://pokemondb.net/ability/sand-force",https://pokemondb.net/pokedex/gastrodon,,,
Ambipom,424,20.3 kg,120.0 cm,Normal,"Technician,Pickup,Skill Link"," Powers up the Pokémon's weaker moves., The Pokémon may pick up items., Increases the frequency of multi-strike moves."," https://pokemondb.net/ability/technician, https://pokemondb.net/ability/pickup, https://pokemondb.net/ability/skill-link",https://pokemondb.net/pokedex/ambipom,,,
