Nome,Número,Peso,Altura,Tipos,Habilidades,Habilidades Descrição,Habilidades URL,Url Pokémon,Evoluções,Evoluções Número,Evoluções URL
Zigzagoon,263,17.5 kg,40.0 cm,Normal,"Pickup,Gluttony,Quick Feet,Pickup,Gluttony,Quick Feet"," The Pokémon may pick up items., Encourages the early use of a held Berry., Boosts Speed if there is a status problem., The Pokémon may pick up items., Encourages the early use of a held Berry., Boosts Speed if there is a status problem."," https://pokemondb.net/ability/pickup, https://pokemondb.net/ability/gluttony, https://pokemondb.net/ability/quick-feet, https://pokemondb.net/ability/pickup, https://pokemondb.net/ability/gluttony, https://pokemondb.net/ability/quick-feet",https://pokemondb.net/pokedex/zigzagoon,"Linoone,Obstagoon"," #0264, #0862"," https://pokemondb.net/pokedex/linoone, https://pokemondb.net/pokedex/zigzagoon, https://pokemondb.net/pokedex/linoone, https://pokemondb.net/pokedex/obstagoon"
Beautifly,267,28.4 kg,100.0 cm,"Bug,Flying","Swarm,Rivalry"," Powers up Bug-type moves in a pinch., Deals more damage to a Pokémon of same gender."," https://pokemondb.net/ability/swarm, https://pokemondb.net/ability/rivalry",https://pokemondb.net/pokedex/beautifly,,,
Linoone,264,32.5 kg,50.0 cm,Normal,"Pickup,Gluttony,Quick Feet,Pickup,Gluttony,Quick Feet"," The Pokémon may pick up items., Encourages the early use of a held Berry., Boosts Speed if there is a status problem., The Pokémon may pick up items., Encourages the early use of a held Berry., Boosts Speed if there is a status problem."," https://pokemondb.net/ability/pickup, https://pokemondb.net/ability/gluttony, https://pokemondb.net/ability/quick-feet, https://pokemondb.net/ability/pickup, https://pokemondb.net/ability/gluttony, https://pokemondb.net/ability/quick-feet",https://pokemondb.net/pokedex/linoone,"Zigzagoon,Linoone,Obstagoon"," #0263, #0264, #0862"," https://pokemondb.net/pokedex/linoone, https://pokemondb.net/pokedex/zigzagoon, https://pokemondb.net/pokedex/linoone, https://pokemondb.net/pokedex/obstagoon"
Lotad,270,2.6 kg,50.0 cm,"Water,Grass","Swift Swim,Rain Dish,Own Tempo"," Boosts the Pokémon's Speed in rain., The Pokémon gradually regains HP in rain., Prevents the Pokémon from becoming confused."," https://pokemondb.net/ability/swift-swim, https://pokemondb.net/ability/rain-dish, https://pokemondb.net/ability/own-tempo",https://pokemondb.net/pokedex/lotad,"Lombre,Ludicolo"," #0271, #0272"," https://pokemondb.net/pokedex/lombre, https://pokemondb.net/pokedex/ludicolo"
Dustox,269,31.6 kg,120.0 cm,"Bug,Poison","Shield Dust,Compound Eyes"," Blocks the added effects of attacks taken., The Pokémon's accuracy is boosted."," https://pokemondb.net/ability/shield-dust, https://pokemondb.net/ability/compound-eyes",https://pokemondb.net/pokedex/dustox,,,
Cascoon,268,11.5 kg,70.0 cm,Bug,Shed Skin, The Pokémon may heal its own status problems., https://pokemondb.net/ability/shed-skin,https://pokemondb.net/pokedex/cascoon,,,
Marshtomp,259,28.0 kg,70.0 cm,"Water,Ground","Torrent,Damp"," Powers up Water-type moves in a pinch., Prevents the use of self-destructing moves."," https://pokemondb.net/ability/torrent, https://pokemondb.net/ability/damp",https://pokemondb.net/pokedex/marshtomp,Swampert, #0260," https://pokemondb.net/pokedex/marshtomp, https://pokemondb.net/pokedex/swampert"
Poochyena,261,13.6 kg,50.0 cm,Dark,"Run Away,Quick Feet,Rattled"," Enables a sure getaway from wild Pokémon., Boosts Speed if there is a status problem., Bug, Ghost or Dark type moves scare it and boost its Speed."," https://pokemondb.net/ability/run-away, https://pokemondb.net/ability/quick-feet, https://pokemondb.net/ability/rattled",https://pokemondb.net/pokedex/poochyena,Mightyena, #0262, https://pokemondb.net/pokedex/mightyena
Wurmple,265,3.6 kg,30.0 cm,Bug,"Shield Dust,Run Away"," Blocks the added effects of attacks taken., Enables a sure getaway from wild Pokémon."," https://pokemondb.net/ability/shield-dust, https://pokemondb.net/ability/run-away",https://pokemondb.net/pokedex/wurmple,,,
Mudkip,258,7.6 kg,40.0 cm,Water,"Torrent,Damp"," Powers up Water-type moves in a pinch., Prevents the use of self-destructing moves."," https://pokemondb.net/ability/torrent, https://pokemondb.net/ability/damp",https://pokemondb.net/pokedex/mudkip,"Marshtomp,Swampert"," #0259, #0260"," https://pokemondb.net/pokedex/marshtomp, https://pokemondb.net/pokedex/swampert"
Swampert,260,81.9 kg,150.0 cm,"Water,Ground","Torrent,Damp,Swift Swim"," Powers up Water-type moves in a pinch., Prevents the use of self-destructing moves., Boosts the Pokémon's Speed in rain."," https://pokemondb.net/ability/torrent, https://pokemondb.net/ability/damp, https://pokemondb.net/ability/swift-swim",https://pokemondb.net/pokedex/swampert,,,
Blaziken,257,52.0 kg,190.0 cm,"Fire,Fighting","Blaze,Speed Boost,Speed Boost"," Powers up Fire-type moves in a pinch., Its Speed stat is gradually boosted., Its Speed stat is gradually boosted."," https://pokemondb.net/ability/blaze, https://pokemondb.net/ability/speed-boost, https://pokemondb.net/ability/speed-boost",https://pokemondb.net/pokedex/blaziken,,,
Combusken,256,19.5 kg,90.0 cm,"Fire,Fighting","Blaze,Speed Boost"," Powers up Fire-type moves in a pinch., Its Speed stat is gradually boosted."," https://pokemondb.net/ability/blaze, https://pokemondb.net/ability/speed-boost",https://pokemondb.net/pokedex/combusken,Blaziken, #0257," https://pokemondb.net/pokedex/combusken, https://pokemondb.net/pokedex/blaziken"
Torchic,255,2.5 kg,40.0 cm,Fire,"Blaze,Speed Boost"," Powers up Fire-type moves in a pinch., Its Speed stat is gradually boosted."," https://pokemondb.net/ability/blaze, https://pokemondb.net/ability/speed-boost",https://pokemondb.net/pokedex/torchic,"Combusken,Blaziken"," #0256, #0257"," https://pokemondb.net/pokedex/combusken, https://pokemondb.net/pokedex/blaziken"
Sceptile,254,52.2 kg,170.0 cm,Grass,"Overgrow,Unburden,Lightning Rod"," Powers up Grass-type moves in a pinch., Raises Speed if a held item is used., Draws in all Electric-type moves to up Sp. Attack."," https://pokemondb.net/ability/overgrow, https://pokemondb.net/ability/unburden, https://pokemondb.net/ability/lightning-rod",https://pokemondb.net/pokedex/sceptile,,,
Grovyle,253,21.6 kg,90.0 cm,Grass,"Overgrow,Unburden"," Powers up Grass-type moves in a pinch., Raises Speed if a held item is used."," https://pokemondb.net/ability/overgrow, https://pokemondb.net/ability/unburden",https://pokemondb.net/pokedex/grovyle,Sceptile, #0254," https://pokemondb.net/pokedex/grovyle, https://pokemondb.net/pokedex/sceptile"
Treecko,252,5.0 kg,50.0 cm,Grass,"Overgrow,Unburden"," Powers up Grass-type moves in a pinch., Raises Speed if a held item is used."," https://pokemondb.net/ability/overgrow, https://pokemondb.net/ability/unburden",https://pokemondb.net/pokedex/treecko,"Grovyle,Sceptile"," #0253, #0254"," https://pokemondb.net/pokedex/grovyle, https://pokemondb.net/pokedex/sceptile"
Celebi,251,5.0 kg,60.0 cm,"Psychic,Grass",Natural Cure, All status problems heal when it switches out., https://pokemondb.net/ability/natural-cure,https://pokemondb.net/pokedex/celebi,,,
Ho-oh,250,199.0 kg,380.0 cm,"Fire,Flying","Pressure,Regenerator"," The Pokémon raises the foe's PP usage., Restores a little HP when withdrawn from battle."," https://pokemondb.net/ability/pressure, https://pokemondb.net/ability/regenerator",https://pokemondb.net/pokedex/ho-oh,,,
Lugia,249,216.0 kg,520.0 cm,"Psychic,Flying","Pressure,Multiscale"," The Pokémon raises the foe's PP usage., Reduces damage when HP is full."," https://pokemondb.net/ability/pressure, https://pokemondb.net/ability/multiscale",https://pokemondb.net/pokedex/lugia,,,
Tyranitar,248,202.0 kg,200.0 cm,"Rock,Dark","Sand Stream,Unnerve,Sand Stream"," The Pokémon summons a sandstorm in battle., Makes the foe nervous and unable to eat Berries., The Pokémon summons a sandstorm in battle."," https://pokemondb.net/ability/sand-stream, https://pokemondb.net/ability/unnerve, https://pokemondb.net/ability/sand-stream",https://pokemondb.net/pokedex/tyranitar,,,
Pupitar,247,152.0 kg,120.0 cm,"Rock,Ground",Shed Skin, The Pokémon may heal its own status problems., https://pokemondb.net/ability/shed-skin,https://pokemondb.net/pokedex/pupitar,Tyranitar, #0248," https://pokemondb.net/pokedex/pupitar, https://pokemondb.net/pokedex/tyranitar"
Larvitar,246,72.0 kg,60.0 cm,"Rock,Ground","Guts,Sand Veil"," Boosts Attack if there is a status problem., Boosts the Pokémon's evasion in a sandstorm."," https://pokemondb.net/ability/guts, https://pokemondb.net/ability/sand-veil",https://pokemondb.net/pokedex/larvitar,"Pupitar,Tyranitar"," #0247, #0248"," https://pokemondb.net/pokedex/pupitar, https://pokemondb.net/pokedex/tyranitar"
Suicune,245,187.0 kg,200.0 cm,Water,"Pressure,Inner Focus"," The Pokémon raises the foe's PP usage., The Pokémon is protected from flinching."," https://pokemondb.net/ability/pressure, https://pokemondb.net/ability/inner-focus",https://pokemondb.net/pokedex/suicune,,,
Entei,244,198.0 kg,210.0 cm,Fire,"Pressure,Inner Focus"," The Pokémon raises the foe's PP usage., The Pokémon is protected from flinching."," https://pokemondb.net/ability/pressure, https://pokemondb.net/ability/inner-focus",https://pokemondb.net/pokedex/entei,,,
Raikou,243,178.0 kg,190.0 cm,Electric,"Pressure,Inner Focus"," The Pokémon raises the foe's PP usage., The Pokémon is protected from flinching."," https://pokemondb.net/ability/pressure, https://pokemondb.net/ability/inner-focus",https://pokemondb.net/pokedex/raikou,,,
Blissey,242,46.8 kg,150.0 cm,Normal,"Natural Cure,Serene Grace,Healer"," All status problems heal when it switches out., Boosts the likelihood of added effects appearing., May heal an ally's status conditions."," https://pokemondb.net/ability/natural-cure, https://pokemondb.net/ability/serene-grace, https://pokemondb.net/ability/healer",https://pokemondb.net/pokedex/blissey,,,
Miltank,241,75.5 kg,120.0 cm,Normal,"Thick Fat,Scrappy,Sap Sipper"," Ups resistance to Fire- and Ice-type moves., Enables moves to hit Ghost-type Pokémon., Boosts Attack when hit by a Grass-type move."," https://pokemondb.net/ability/thick-fat, https://pokemondb.net/ability/scrappy, https://pokemondb.net/ability/sap-sipper",https://pokemondb.net/pokedex/miltank,,,
Magby,240,21.4 kg,70.0 cm,Fire,"Flame Body,Vital Spirit"," Contact with the Pokémon may burn the attacker., Prevents the Pokémon from falling asleep."," https://pokemondb.net/ability/flame-body, https://pokemondb.net/ability/vital-spirit",https://pokemondb.net/pokedex/magby,"Magmar,Magmortar"," #0126, #0467"," https://pokemondb.net/pokedex/magmar, https://pokemondb.net/pokedex/magmortar"
Elekid,239,23.5 kg,60.0 cm,Electric,"Static,Vital Spirit"," Contact with the Pokémon may cause paralysis., Prevents the Pokémon from falling asleep."," https://pokemondb.net/ability/static, https://pokemondb.net/ability/vital-spirit",https://pokemondb.net/pokedex/elekid,"Electabuzz,Electivire"," #0125, #0466"," https://pokemondb.net/pokedex/electabuzz, https://pokemondb.net/pokedex/electivire"
Smoochum,238,6.0 kg,40.0 cm,"Ice,Psychic","Oblivious,Forewarn,Hydration"," Prevents it from becoming infatuated., Determines what moves a foe has., Heals status problems if it is raining."," https://pokemondb.net/ability/oblivious, https://pokemondb.net/ability/forewarn, https://pokemondb.net/ability/hydration",https://pokemondb.net/pokedex/smoochum,Jynx, #0124, https://pokemondb.net/pokedex/jynx
Hitmontop,237,48.0 kg,140.0 cm,Fighting,"Intimidate,Technician,Steadfast"," Lowers the foe's Attack stat., Powers up the Pokémon's weaker moves., Raises Speed each time the Pokémon flinches."," https://pokemondb.net/ability/intimidate, https://pokemondb.net/ability/technician, https://pokemondb.net/ability/steadfast",https://pokemondb.net/pokedex/hitmontop,,,
Smeargle,235,58.0 kg,120.0 cm,Normal,"Own Tempo,Technician,Moody"," Prevents the Pokémon from becoming confused., Powers up the Pokémon's weaker moves., Raises one stat and lowers another."," https://pokemondb.net/ability/own-tempo, https://pokemondb.net/ability/technician, https://pokemondb.net/ability/moody",https://pokemondb.net/pokedex/smeargle,,,
Tyrogue,236,21.0 kg,70.0 cm,Fighting,"Guts,Steadfast,Vital Spirit"," Boosts Attack if there is a status problem., Raises Speed each time the Pokémon flinches., Prevents the Pokémon from falling asleep."," https://pokemondb.net/ability/guts, https://pokemondb.net/ability/steadfast, https://pokemondb.net/ability/vital-spirit",https://pokemondb.net/pokedex/tyrogue,,,
Stantler,234,71.2 kg,140.0 cm,Normal,"Intimidate,Frisk,Sap Sipper"," Lowers the foe's Attack stat., The Pokémon can check a foe's held item., Boosts Attack when hit by a Grass-type move."," https://pokemondb.net/ability/intimidate, https://pokemondb.net/ability/frisk, https://pokemondb.net/ability/sap-sipper",https://pokemondb.net/pokedex/stantler,Wyrdeer, #0899, https://pokemondb.net/pokedex/wyrdeer
Porygon2,233,32.5 kg,60.0 cm,Normal,"Trace,Download,Analytic"," The Pokémon copies a foe's Ability., Adjusts power according to a foe's defenses., Boosts move power when the Pokémon moves last."," https://pokemondb.net/ability/trace, https://pokemondb.net/ability/download, https://pokemondb.net/ability/analytic",https://pokemondb.net/pokedex/porygon2,Porygon-Z, #0474," https://pokemondb.net/pokedex/porygon2, https://pokemondb.net/pokedex/porygon-z"
Donphan,232,120.0 kg,110.00000000000001 cm,Ground,"Sturdy,Sand Veil"," It cannot be knocked out with one hit., Boosts the Pokémon's evasion in a sandstorm."," https://pokemondb.net/ability/sturdy, https://pokemondb.net/ability/sand-veil",https://pokemondb.net/pokedex/donphan,,,
Phanpy,231,33.5 kg,50.0 cm,Ground,"Pickup,Sand Veil"," The Pokémon may pick up items., Boosts the Pokémon's evasion in a sandstorm."," https://pokemondb.net/ability/pickup, https://pokemondb.net/ability/sand-veil",https://pokemondb.net/pokedex/phanpy,Donphan, #0232, https://pokemondb.net/pokedex/donphan
Houndoom,229,35.0 kg,140.0 cm,"Dark,Fire","Early Bird,Flash Fire,Unnerve,Solar Power"," The Pokémon awakens quickly from sleep., It powers up Fire-type moves if it's hit by one., Makes the foe nervous and unable to eat Berries., In sunshine, Sp. Atk is boosted but HP decreases."," https://pokemondb.net/ability/early-bird, https://pokemondb.net/ability/flash-fire, https://pokemondb.net/ability/unnerve, https://pokemondb.net/ability/solar-power",https://pokemondb.net/pokedex/houndoom,,,
Skarmory,227,50.5 kg,170.0 cm,"Steel,Flying","Keen Eye,Sturdy,Weak Armor"," Prevents other Pokémon from lowering accuracy., It cannot be knocked out with one hit., Physical attacks lower Defense and raise Speed."," https://pokemondb.net/ability/keen-eye, https://pokemondb.net/ability/sturdy, https://pokemondb.net/ability/weak-armor",https://pokemondb.net/pokedex/skarmory,,,
Houndour,228,10.8 kg,60.0 cm,"Dark,Fire","Early Bird,Flash Fire,Unnerve"," The Pokémon awakens quickly from sleep., It powers up Fire-type moves if it's hit by one., Makes the foe nervous and unable to eat Berries."," https://pokemondb.net/ability/early-bird, https://pokemondb.net/ability/flash-fire, https://pokemondb.net/ability/unnerve",https://pokemondb.net/pokedex/houndour,Houndoom, #0229, https://pokemondb.net/pokedex/houndoom
Kingdra,230,152.0 kg,180.0 cm,"Water,Dragon","Swift Swim,Sniper,Damp"," Boosts the Pokémon's Speed in rain., Powers up moves if they become critical hits., Prevents the use of self-destructing moves."," https://pokemondb.net/ability/swift-swim, https://pokemondb.net/ability/sniper, https://pokemondb.net/ability/damp",https://pokemondb.net/pokedex/kingdra,,,
Mantine,226,220.0 kg,210.0 cm,"Water,Flying","Swift Swim,Water Absorb,Water Veil"," Boosts the Pokémon's Speed in rain., Restores HP if hit by a Water-type move., Prevents the Pokémon from getting a burn."," https://pokemondb.net/ability/swift-swim, https://pokemondb.net/ability/water-absorb, https://pokemondb.net/ability/water-veil",https://pokemondb.net/pokedex/mantine,,,
Delibird,225,16.0 kg,90.0 cm,"Ice,Flying","Vital Spirit,Hustle,Insomnia"," Prevents the Pokémon from falling asleep., Boosts the Attack stat, but lowers accuracy., Prevents the Pokémon from falling asleep."," https://pokemondb.net/ability/vital-spirit, https://pokemondb.net/ability/hustle, https://pokemondb.net/ability/insomnia",https://pokemondb.net/pokedex/delibird,,,
Octillery,224,28.5 kg,90.0 cm,Water,"Suction Cups,Sniper,Moody"," Negates all moves that force switching out., Powers up moves if they become critical hits., Raises one stat and lowers another."," https://pokemondb.net/ability/suction-cups, https://pokemondb.net/ability/sniper, https://pokemondb.net/ability/moody",https://pokemondb.net/pokedex/octillery,,,
Remoraid,223,12.0 kg,60.0 cm,Water,"Hustle,Sniper,Moody"," Boosts the Attack stat, but lowers accuracy., Powers up moves if they become critical hits., Raises one stat and lowers another."," https://pokemondb.net/ability/hustle, https://pokemondb.net/ability/sniper, https://pokemondb.net/ability/moody",https://pokemondb.net/pokedex/remoraid,Octillery, #0224, https://pokemondb.net/pokedex/octillery
Corsola,222,5.0 kg,60.0 cm,"Water,Rock","Hustle,Natural Cure,Regenerator,Weak Armor,Cursed Body"," Boosts the Attack stat, but lowers accuracy., All status problems heal when it switches out., Restores a little HP when withdrawn from battle., Physical attacks lower Defense and raise Speed., May disable a move used on the Pokémon."," https://pokemondb.net/ability/hustle, https://pokemondb.net/ability/natural-cure, https://pokemondb.net/ability/regenerator, https://pokemondb.net/ability/weak-armor, https://pokemondb.net/ability/cursed-body",https://pokemondb.net/pokedex/corsola,Cursola, #0864, https://pokemondb.net/pokedex/cursola
Piloswine,221,55.8 kg,110.00000000000001 cm,"Ice,Ground","Oblivious,Snow Cloak,Thick Fat"," Prevents it from becoming infatuated., Raises evasion in a hailstorm., Ups resistance to Fire- and Ice-type moves."," https://pokemondb.net/ability/oblivious, https://pokemondb.net/ability/snow-cloak, https://pokemondb.net/ability/thick-fat",https://pokemondb.net/pokedex/piloswine,Mamoswine, #0473," https://pokemondb.net/pokedex/piloswine, https://pokemondb.net/pokedex/mamoswine"
Swinub,220,6.5 kg,40.0 cm,"Ice,Ground","Oblivious,Snow Cloak,Thick Fat"," Prevents it from becoming infatuated., Raises evasion in a hailstorm., Ups resistance to Fire- and Ice-type moves."," https://pokemondb.net/ability/oblivious, https://pokemondb.net/ability/snow-cloak, https://pokemondb.net/ability/thick-fat",https://pokemondb.net/pokedex/swinub,"Piloswine,Mamoswine"," #0221, #0473"," https://pokemondb.net/pokedex/piloswine, https://pokemondb.net/pokedex/mamoswine"
Magcargo,219,55.0 kg,80.0 cm,"Fire,Rock","Magma Armor,Flame Body,Weak Armor"," Prevents the Pokémon from becoming frozen., Contact with the Pokémon may burn the attacker., Physical attacks lower Defense and raise Speed."," https://pokemondb.net/ability/magma-armor, https://pokemondb.net/ability/flame-body, https://pokemondb.net/ability/weak-armor",https://pokemondb.net/pokedex/magcargo,,,
Slugma,218,35.0 kg,70.0 cm,Fire,"Magma Armor,Flame Body,Weak Armor"," Prevents the Pokémon from becoming frozen., Contact with the Pokémon may burn the attacker., Physical attacks lower Defense and raise Speed."," https://pokemondb.net/ability/magma-armor, https://pokemondb.net/ability/flame-body, https://pokemondb.net/ability/weak-armor",https://pokemondb.net/pokedex/slugma,Magcargo, #0219, https://pokemondb.net/pokedex/magcargo
Ursaring,217,125.8 kg,180.0 cm,Normal,"Guts,Quick Feet,Unnerve"," Boosts Attack if there is a status problem., Boosts Speed if there is a status problem., Makes the foe nervous and unable to eat Berries."," https://pokemondb.net/ability/guts, https://pokemondb.net/ability/quick-feet, https://pokemondb.net/ability/unnerve",https://pokemondb.net/pokedex/ursaring,Ursaluna, #0901," https://pokemondb.net/pokedex/ursaring, https://pokemondb.net/pokedex/ursaluna"
Teddiursa,216,8.8 kg,60.0 cm,Normal,"Pickup,Quick Feet,Honey Gather"," The Pokémon may pick up items., Boosts Speed if there is a status problem., The Pokémon may gather Honey from somewhere."," https://pokemondb.net/ability/pickup, https://pokemondb.net/ability/quick-feet, https://pokemondb.net/ability/honey-gather",https://pokemondb.net/pokedex/teddiursa,"Ursaring,Ursaluna"," #0217, #0901"," https://pokemondb.net/pokedex/ursaring, https://pokemondb.net/pokedex/ursaluna"
Sneasel,215,28.0 kg,90.0 cm,"Dark,Ice","Inner Focus,Keen Eye,Pickpocket,Inner Focus,Keen Eye,Pickpocket"," The Pokémon is protected from flinching., Prevents other Pokémon from lowering accuracy., Steals an item when hit by another Pokémon., The Pokémon is protected from flinching., Prevents other Pokémon from lowering accuracy., Steals an item when hit by another Pokémon."," https://pokemondb.net/ability/inner-focus, https://pokemondb.net/ability/keen-eye, https://pokemondb.net/ability/pickpocket, https://pokemondb.net/ability/inner-focus, https://pokemondb.net/ability/keen-eye, https://pokemondb.net/ability/pickpocket",https://pokemondb.net/pokedex/sneasel,Sneasler, #0903," https://pokemondb.net/pokedex/weavile, https://pokemondb.net/pokedex/sneasel, https://pokemondb.net/pokedex/sneasler"
Heracross,214,54.0 kg,150.0 cm,"Bug,Fighting","Swarm,Guts,Moxie,Skill Link"," Powers up Bug-type moves in a pinch., Boosts Attack if there is a status problem., Boosts Attack after knocking out any Pokémon., Increases the frequency of multi-strike moves."," https://pokemondb.net/ability/swarm, https://pokemondb.net/ability/guts, https://pokemondb.net/ability/moxie, https://pokemondb.net/ability/skill-link",https://pokemondb.net/pokedex/heracross,,,
Scizor,212,118.0 kg,180.0 cm,"Bug,Steel","Swarm,Technician,Light Metal,Technician"," Powers up Bug-type moves in a pinch., Powers up the Pokémon's weaker moves., Halves the Pokémon's weight., Powers up the Pokémon's weaker moves."," https://pokemondb.net/ability/swarm, https://pokemondb.net/ability/technician, https://pokemondb.net/ability/light-metal, https://pokemondb.net/ability/technician",https://pokemondb.net/pokedex/scizor,,,
Qwilfish,211,3.9 kg,50.0 cm,"Water,Poison","Poison Point,Swift Swim,Intimidate,Poison Point,Swift Swim,Intimidate"," Contact with the Pokémon may poison the attacker., Boosts the Pokémon's Speed in rain., Lowers the foe's Attack stat., Contact with the Pokémon may poison the attacker., Boosts the Pokémon's Speed in rain., Lowers the foe's Attack stat."," https://pokemondb.net/ability/poison-point, https://pokemondb.net/ability/swift-swim, https://pokemondb.net/ability/intimidate, https://pokemondb.net/ability/poison-point, https://pokemondb.net/ability/swift-swim, https://pokemondb.net/ability/intimidate",https://pokemondb.net/pokedex/qwilfish,Overqwil, #0904, https://pokemondb.net/pokedex/overqwil
Shuckle,213,20.5 kg,60.0 cm,"Bug,Rock","Sturdy,Gluttony,Contrary"," It cannot be knocked out with one hit., Encourages the early use of a held Berry., Makes stat changes have an opposite effect."," https://pokemondb.net/ability/sturdy, https://pokemondb.net/ability/gluttony, https://pokemondb.net/ability/contrary",https://pokemondb.net/pokedex/shuckle,,,
Granbull,210,48.7 kg,140.0 cm,Fairy,"Intimidate,Quick Feet,Rattled"," Lowers the foe's Attack stat., Boosts Speed if there is a status problem., Bug, Ghost or Dark type moves scare it and boost its Speed."," https://pokemondb.net/ability/intimidate, https://pokemondb.net/ability/quick-feet, https://pokemondb.net/ability/rattled",https://pokemondb.net/pokedex/granbull,,,
Gligar,207,64.8 kg,110.00000000000001 cm,"Ground,Flying","Hyper Cutter,Sand Veil,Immunity"," Prevents other Pokémon from lowering Attack stat., Boosts the Pokémon's evasion in a sandstorm., Prevents the Pokémon from getting poisoned."," https://pokemondb.net/ability/hyper-cutter, https://pokemondb.net/ability/sand-veil, https://pokemondb.net/ability/immunity",https://pokemondb.net/pokedex/gligar,Gliscor, #0472, https://pokemondb.net/pokedex/gliscor
Dunsparce,206,14.0 kg,150.0 cm,Normal,"Serene Grace,Run Away,Rattled"," Boosts the likelihood of added effects appearing., Enables a sure getaway from wild Pokémon., Bug, Ghost or Dark type moves scare it and boost its Speed."," https://pokemondb.net/ability/serene-grace, https://pokemondb.net/ability/run-away, https://pokemondb.net/ability/rattled",https://pokemondb.net/pokedex/dunsparce,,,
Pineco,204,7.2 kg,60.0 cm,Bug,"Sturdy,Overcoat"," It cannot be knocked out with one hit., Protects the Pokémon from weather damage."," https://pokemondb.net/ability/sturdy, https://pokemondb.net/ability/overcoat",https://pokemondb.net/pokedex/pineco,Forretress, #0205, https://pokemondb.net/pokedex/forretress
Girafarig,203,41.5 kg,150.0 cm,"Normal,Psychic","Inner Focus,Early Bird,Sap Sipper"," The Pokémon is protected from flinching., The Pokémon awakens quickly from sleep., Boosts Attack when hit by a Grass-type move."," https://pokemondb.net/ability/inner-focus, https://pokemondb.net/ability/early-bird, https://pokemondb.net/ability/sap-sipper",https://pokemondb.net/pokedex/girafarig,Farigiraf, #0981, https://pokemondb.net/pokedex/farigiraf
Forretress,205,125.8 kg,120.0 cm,"Bug,Steel","Sturdy,Overcoat"," It cannot be knocked out with one hit., Protects the Pokémon from weather damage."," https://pokemondb.net/ability/sturdy, https://pokemondb.net/ability/overcoat",https://pokemondb.net/pokedex/forretress,,,
Wobbuffet,202,28.5 kg,130.0 cm,Psychic,"Shadow Tag,Telepathy"," Prevents the foe from escaping., Anticipates an ally's attack and dodges it."," https://pokemondb.net/ability/shadow-tag, https://pokemondb.net/ability/telepathy",https://pokemondb.net/pokedex/wobbuffet,,,
